{
  "$schema": "https://json-schema.org/draft/2020-12/schema",
  "$id": "https://raw.githubusercontent.com/AIAllTheThingz/Public-Access-Agents/main/schemas/v1/risk-classification.schema.json",
  "title": "Risk Classification",
  "description": "Records a change risk level, rationale, evaluated factors, required reviewers, rollback requirement, ownership, and reassessment triggers.",
  "type": "object",
  "additionalProperties": false,
  "required": [
    "level",
    "rationale",
    "factors"
  ],
  "properties": {
    "level": {
      "enum": [
        "low",
        "moderate",
        "high",
        "critical"
      ]
    },
    "rationale": {
      "type": "string",
      "minLength": 1
    },
    "factors": {
      "type": "object",
      "minProperties": 1,
      "additionalProperties": {
        "type": "string",
        "minLength": 1
      }
    },
    "requiredReviewers": {
      "type": "array",
      "items": {
        "type": "string",
        "minLength": 1
      },
      "uniqueItems": true
    },
    "rollbackRequired": {
      "type": "boolean"
    },
    "owner": {
      "type": "string",
      "minLength": 1
    },
    "classifiedAt": {
      "type": "string",
      "format": "date-time"
    },
    "reassessmentTriggers": {
      "type": "array",
      "items": {
        "type": "string",
        "minLength": 1
      },
      "uniqueItems": true
    },
    "schemaVersion": {
      "type": "string",
      "const": "1.0.0",
      "description": "Optional explicit instance contract version. Omitted legacy instances are interpreted as version 1.0.0."
    },
    "extensions": {
      "type": "object",
      "description": "Namespaced extension data. Extension keys must be organization- or product-specific and must not redefine standard fields.",
      "propertyNames": {
        "pattern": "^[A-Za-z][A-Za-z0-9_.-]{1,127}$"
      },
      "additionalProperties": true
    }
  },
  "x-schemaVersion": "1.0.0"
}
